,拼音,解释,例子,用法,谜语,感情,英语,结构,字数,年代,热度,词语解释,出处,正音,辨形,辨析,繁体,组合,歇后语,成语故事
若即若离,ruò jí ruò lí,即；凑近。好象接近；又好像不接近。形容对人保持一定距离。,他的书虽然和《了凡纲鉴》也有些相合，但大段又很不相同，若即若离，令人不知道讲起来应该怎样拉在一处。（鲁迅《彷徨 高老夫子》）,联合式；作谓语、定语、状语；形容态度不明朗。,,中性,hold oneself slightly aloof,联合式,四字,近代,常用,若即若离,清 文康《儿女英雄传》：“这边两个新人在新房里乍来乍去，如蛱蝶穿花；若即若离，似蜻蜓点水。”,“即”，不能读作“jì”。,“即”，不能写作“级”。,,若即若離,ABAC式,,
一劳永逸,yī láo yǒng yì,逸：安逸。辛苦一次。把事情办好；以后就可以不再费力了。,“一劳永逸”的话，有是有的，而“一劳永逸”的事却极少。（鲁迅《花边文学 再论重译》）,连动式；作谓语、宾语、定语；含褒义。,最有效率的劳动,褒义,get sb. done once ad for all,连动式,四字,古代,常用,一劳永逸,东汉 班固《封燕然山铭》：“兹可谓一劳而久逸。暂费而永无宁者也。”,“逸”，不能读作“yí”。,“逸”，不能写作“益”。,,一勞永逸,,,
支支吾吾,zhī zhī wú wú,亦作“支支梧梧”。谓说话吞吞吐吐，含混躲闪。,指导员觉得黄金宝有点反常，两只眼映着灯闪光，好像含着泪，问他又支支吾吾地不肯明说。杨朔《熔炉》,作定语、状语；指言语含糊。,两只鹅,中性,waffle（equivocate; falter）,联合式,四字,近代,常用,支支吾吾,清·文康《儿女英雄传》第五回：“我既这等苦苦相问，你自然就该侃侃而谈，怎么问了半日，你一味的吞吞吐吐，支支吾吾？”,,,,,AABB式,,
冷嘲热讽,lěng cháo rè fěng,冷嘲：冷言冷语；尖刁刻薄的风凉话；热讽：辛辣难忍的讽刺语。用尖锐、辛辣的语言进行讥笑和讽刺。,见了老徐，说了几句冷嘲热讽的话儿。（蔡东藩、许廑父《民国通俗演义》第一一六回）,主谓式；作谓语、定语、状语；含贬义。,寒流来了吹暖气,贬义,rant and rave,联合式,四字,近代,常用,冷嘲热讽,清 袁枚《随园三十二种 牍外余言》：“人人知之，皆有不平之意。故晋大夫七嘴八舌，冷讥热讽。”,“嘲”，不能读作“zhāo”。,“嘲”，不能写作“朝”。,冷嘲热讽和“冷言冷语”；都可以表示含有讽刺意味的话；但冷嘲热讽含有辛辣的嘲笑的意思；讽刺的刻薄度更强；是中性成语；“冷言冷语”是贬义成语。,冷謿熱諷,,,
目不暇接,mù bù xiá jiē,暇：闲暇；接：接收。可看的东西太多；眼睛都忙得看不过来了。,一切艺术的道理也是这样，单一必然导致枯燥。而丰富多采、目不暇接则是绝大多数人所欢迎的。（秦牧《菊花与金鱼》）,主谓式；作谓语、定语、状语；用于令人后。,,中性,too many things for the eye to see,主谓式,四字,古代,常用,目不暇接,清 郑燮《潍县署中与舍弟墨之二》：“见其扬翬振彩，倏来倏往，目不暇给。”,“暇”，不能读作“jiǎ”。,暇，不能写作“目蹤”。,目不暇接和“应接不暇”；都用来形容东西很多；看不过来。但“应接不暇”还可形容头绪多；事情忙；来不及应付；目不暇接不能。,,,,
骇人听闻,hài rén tīng wén,骇：惊吓；震惊。指使人听了非常吃惊。,任听部下逞艳于非时之候，献媚于世主之前，致令时序颠倒，骇人听闻。（清 李汝珍《镜花缘》第六回）,兼语式；作谓语、定语；含贬义。,谨防隔墙有耳,贬义,astounding; appalling,复杂式,四字,古代,常用,骇人听闻,宋 朱熹《朱文公文集 答詹师书》：“浙中近年怪论百出，骇人听闻，坏人心术。”,“骇”，不能读作“hái”。,“骇”，不能写作“赅”。,骇人听闻和“耸人听闻”、“危言耸听”；都含有“使人听了吃惊”的意思。不同在于：骇人听闻重在“骇”字；“耸人听闻”重在“耸”字；“危言耸听”则重在“言”字。,駭人聽聞,,,骇人听闻
人满为患,rén mǎn wéi huàn,因人多造成了困难。,各地监狱，都有人满为患之苦。方志敏《狱中记实》一,作谓语、定语；用于口语。,骄者必败,中性,be overcrowded with people（be overstaffed）,主谓式,四字,当代,常用,人满为患,郭沫若《洪波曲》第二章一：“客栈小，已经人满为患。”,,,,人滿為患,,,
风云变幻,fēng yún biàn huàn,风云：比喻变幻动荡的局势；变幻：变化不定。形容天气变化无常　。现比喻局势复杂；变化急速；难以预料。,然而那么风云变幻的事，恐怕世界上是不多有的，我没有料到，未曾描写，可见我还不很有“毒笔”。（鲁迅《三闲集 通信》）,主谓式；作谓语、宾语、定语；形容自然及局势的变化。,气象万千,中性,rapid changes in the situation,主谓式,四字,古代,常用,风云变幻,宋 陆游《剑南诗稿》：“风云变化几席上，蛟鼋出波澜杆前。”,,“幻”，不能写作“幼”、“换”。,,風雲變幻,,,
分门别类,fēn mén bié lèi,门：类；别：区别。根据事物的特征分类。,我只要现在的时务书，分门别类的便好。（清 李宝嘉《文明小史》第三十四回）,联合式；作谓语、状语；指按事物性质分类。,,中性,sort out into categories,联合式,四字,古代,常用,分门别类,明 朱国祯《涌幢小品 志录集》：“《夷坚卷》原四百二十卷，今行者五十一卷。益病其烦芜芟之，分门别类，非全帙也。”,,,,分門别類,,,
大发雷霆,dà fā léi tíng,霆：暴雷；雷霆：震耳的雷声。形容大发脾气；高声怒斥别人。,不知说了一句甚么话，符老爷登时大发雷霆起来，把那独脚桌子一掀。(清 吴趼人《二十年目睹之怪现状》第七十四回),动宾式；作谓语；指大发脾气，大声斥责。,雷雨天,中性,fall into a violent passion,动宾式,四字,古代,常用,大发雷霆,明 凌濛初《初刻拍案惊奇》第15卷：“陈秀才大发雷霆。”,,,（一）大发雷霆和“怒不可遏”。都形容非常愤怒。但大发雷霆重“声”不重“形”；多形容发怒时高声斥责；“怒不可遏”重“形”不重“声”。形容愤怒的感情上不可遏止地显露出来。（二）“暴跳如雷”和大发雷霆；都形容大发脾气。但“暴跳如雷”形容愤怒的情绪是从跳脚的动作中表现出来的；大发雷霆是从声音上流露出来的。,大發靁霆,,,大发雷霆
易如反掌,yì rú fǎn zhǎng,像翻转手掌一样；比喻做事很容易。,藩台又叫首府、首县写信出去，向外府、县替他张罗，大约一二千金，易如反掌。（清 李宝嘉《官场现形记》第十九回）,偏正式；作谓语、定语、状语；比喻事情非常容易做。,转手倒卖,中性,as easy as turning over the plam,主谓式,四字,古代,常用,易如反掌,汉 枚乘《上书谏吴王》：“必若所欲为，危于累卵，难于上天；变所欲为，易如反掌，安于泰山。”,“掌”，不能读作“chēng”。,“反”，不能写作“返”。,易如反掌和“轻而易举”；都表示“事情容易办”；但易如反掌一般用于一些确实容易办到的事；用“反掌”的比喻；强调极其容易；它的容易程度超于“轻而易举”。在否定句中；强调事情很难办时。一般用“轻而易举”而不大用易如反掌。,,,,易如反掌
堂而皇之,táng ér huáng zhī,形容公然毫不隐讳地（多含贬义）。,叶圣陶《四三集·一个练习生》：“现在这时代，劳动做工是堂而皇之的了。”,偏正式；作谓语、定语；含贬义。,骂街,贬义,in state（grand; magnificent）,偏正式,四字,近代,常用,堂而皇之,鲁迅《花边文学 “莎士比亚”》：“末一句是客气话，赞成施先生的其实并不少，要不然，能堂而皇之的在杂志上发表吗？”,,,,,,,
横冲直撞,héng chōng zhí zhuàng,横的冲过去；直的撞过来。形容毫无顾忌地乱冲乱撞或蛮不讲礼。,只见三妖全身甲胄，横冲直撞，左右厮杀。（明 许仲琳《封神演义》第九十六回）,联合式；作谓语、定语、状语；形容肆意行动。,醉汉驾车；十字路口不相让,贬义,dash around madly,联合式,四字,古代,常用,横冲直撞,明 施耐庵《水浒传》第113回：“黑旋风李逵和鲍旭引着两个牌手，在城里横冲直撞，追杀南兵。”,“横”，不能读作“hèng”；“撞”，不能读作“chuàng”。,“冲”，不能写作“充”；“撞”，不能写作“僮”。,,横衝直撞,,过河的卒子；汽车坏了方向盘；腰里别了根扁担,
忍俊不禁,rěn jùn bù jīn,忍俊：原指抑制锋芒外露；后指含笑。禁：止。不能克制自己；忍不住发笑。,大熊猫憨态可掬，小猴子顽皮可爱，使得周围的大人们忍俊不禁，孩子们更是笑得前仰后合。,偏正式；作谓语、状语；指忍不住要发笑。,,中性,cannot help smiling,偏正式,四字,古代,常用,忍俊不禁,唐 崔致远《答徐州时溥书》：“足下去年，忍俊不禁，求荣颇切。”,“禁”，不能读作“jìn”。,“俊”，不能写作“骏”。,,忍儁不禁,,,
彻头彻尾,chè tóu chè wěi,彻：通；透。从头到尾；自始至终；完完全全。,他是个彻头彻尾的机会主义者。,联合式；作定语、状语；含贬义，用于人的思想等。,不彻中,贬义,to the marrow (of one's bones; through and through; out and out ),联合式,四字,古代,常用,彻头彻尾,宋 朱熹《答程正思书》：“盖圣贤之学，彻头彻尾，只是一个敬字。”,“尾”，不能读作“yǐ”。,“彻”，不能写作“沏”。,,徹頭徹尾,ABAC式,,
不屈不挠,bù qū bù náo,屈、挠：弯曲。不屈服。形容不畏强暴和困难；十分顽强；决不屈服。,一百多年来，我们的先人曾跟国内外反动势力进行了不屈不挠的斗争。,联合式；作谓语、定语、状语；含褒义，形容人顽强。,弯腰抓痒,褒义,never give in,联合式,四字,古代,常用,不屈不挠,东汉 班固《汉书 叙传下》：“乐昌笃实，不桡（挠）不诎（屈）。”,“挠”，不能读作“ráo”。,“屈”，不能写作“曲”。,见“百折不挠”。,不屈不撓,ABAC式,,不屈不挠
欣欣向荣,xīn xīn xiàng róng,形容草木长得茂盛。比喻事业蓬勃发展；兴旺昌盛。荣：茂盛。,在其间欣欣向荣的，只有鲜花和绿草，这是比喻对于将来的希望。（叶圣陶《搭班子》）,偏正式；作谓语、定语、状语；含褒义。,高高兴兴学先进,褒义,thriving with each passing day,偏正式,四字,古代,常用,欣欣向荣,晋 陶潜《归去来辞》：“木欣欣以向荣，泉涓涓而始流。”,,“欣”，不能写作“新”。,欣欣向荣和“蒸蒸日上”；都形容事物繁荣。但欣欣向荣多偏重在“繁荣”、“昌盛”；“蒸蒸日上”偏重在“向上”；表明事物发展；上升和提高。,俽俽向榮,AABC式,,欣欣向荣
一马当先,yī mǎ dāng xiān,策马走在最前头。比喻走在领先位置；起带头作用。,李自成看见敌人增加了援军，士气复振，就赶快把人马整顿一下，由他一马当先，继续猛冲猛攻。（姚雪垠《李自成》）,主谓式；作谓语、宾语、状语；含褒义。,端午；张飞上阵,褒义,be in the forefront,主谓式,四字,古代,常用,一马当先,明 施耐庵《水浒传》第96回：“即便勒兵列阵，一马当先，雷震等将簇拥左右。”,“当”，不能读作“dàng”。,“先”，不能写作“仙”。,一马当先和“身先士卒”；都表示勇于去前面；起带头作用。但一马当先可用于其他事物；“身先士卒”仅用于人；而且限用于领导者。,一馬當先,,赛马场上的冠军,
和蔼可亲,hé ǎi kě qīn,指一个人的修养好；对人谦和可亲。和蔼：和气；谦逊。,假若有人愿意来看他，他是个顶和蔼可亲的人。（老舍《四世同堂》二）,联合式；作谓语、定语、状语；形容人的态度谦和。,,褒义,be courteous and accessible,联合式,四字,近代,常用,和蔼可亲,清 李宝嘉《官场现形记》第29回：“原来这唐六轩唐观察为人极其和蔼可亲，见了人总是笑嘻嘻的。”,“和”，不能读作“hè”。,“和”，不能写作“合”；“蔼”，不能写作“霭”。,和蔼可亲和“和颜悦色”、“平易近人”都可形容态度温和。不同在于：①和蔼可亲偏重在“和善”；“平易近人”偏重在“容易接近”；“和颜悦色”偏重在“脸色温和”。②前两者多用于长辈；后者不限。,咊藹可親,,,
忍气吞声,rěn qì tūn shēng,忍：忍耐。吞声：有话不敢说。形容受了气而强自忍下；不能说出来。,她姐姐从小就给财主家做童养媳，忍气吞声地生活了半辈子。,联合式；作谓语、定语、状语；含贬义。,捏着鼻子吹螺号,贬义,hold back one's anger and say nothing,联合式,四字,古代,常用,忍气吞声,元 关汉卿《鲁斋郎》：“你不如休和他争，忍气吞声罢！”,“声”，不能读作“sēng”。,“声”，不能写作“生”。,忍气吞声和“饮泣吞声”；都表示不说什么话；勉强地忍耐着。忍气吞声偏重于“忍”；强调人忍受冤屈；多用于口语。“饮泣吞声”偏重在“饮”；指内心痛苦；不敢表达；多用于书面语。,忍氣吞聲,,打了牙肚里咽；自己碰钉子；哑巴打哈欠；捏着鼻子吃葱,
接踵而至,jiē zhǒng ér zhì,踵：脚后跟；接踵：足跟相接。后头的人脚尖挨上前头人的脚跟；一个跟着一个来到。形容人特别多；络绎不绝。或事情连续不断地发生。也作“继踵而至”、“接踵而来”。,台湾之割，青岛之割，威海之割，接踵而至。（章炳麟《箴新党论》）,偏正式；作谓语、定语；用于书面语。,,中性,come one after another,偏正式,四字,古代,常用,接踵而至,《新编五代史平话 唐史下》：“是日唐主大军接踵而至。”,“踵”，不能读作“zhòng”。,“踵”，不能写作“种”。,见“接二连三”。,,,,
专心致志,zhuān xīn zhì zhì,心里很专一；注意力集中。致：极尽；志：心意；志趣。,不由我不专心致志搞这一套。（叶圣陶《招魂》）,联合式；作谓语、定语、状语；含褒义。,王羲之看鹅,褒义,with single … hearted devotion,联合式,四字,古代,常用,专心致志,先秦 孟轲《孟子 告子上》：“今夫弈之为数，小数也，不专心致志，则不得也。”,,“致”，不能写作“至”。,专心致志与“聚精会神”有别：专心致志侧重于形容志趣专一；“聚精会神”侧重于形容精神集中。,專心致志,,王羲之看鹅,专心致志
双管齐下,shuāng guǎn qí xià,管：笔；齐：同时。双手执笔同时作画。比喻为达到某个目的同时采取两种措施或同时做两件事情。,如此双管齐下，就有可能克服大地主大资产阶级的投降危险并争取时局的好转前途。（毛泽东《克服投降危险，力争时局好转》）,主谓式；作谓语、定语；表示两件事同时进行。,大小号合奏；两台抽水机抽水；既输氧又输液,中性,work along both lines（paint a picture with two brushes at the same time; do two things at a time）,主谓式,四字,古代,常用,双管齐下,宋 郭若虚《图画见闻志 故事拾遗》：“唐张璪员外画山水松石名重于世。尤于画松特出意象，能手握双管一时齐下，一为生枝，一为枯干，势凌风雨，气傲烟霞。”,,“管”，不能写作“菅”。,双管齐下和“左右开弓”；都有“两方面一同施行”的意思；但双管齐下偏重于“两件事同时进行”或“采取两种措施”；“左右开弓”偏重从多方面下手或双手同时做一件事。,雙管齊下,,大小号合奏,双管齐下
错落有致,cuò luò yǒu zhì,致：别致；有情趣；错落：参差交错；致：情趣。形容事物的布局虽然参差不齐；但却极有情趣；使人看了有好感。,颐和园的山水长廊、亭台楼阁，错落有致。,主谓式；作谓语、定语、补语；指事物布局合理可爱。,肴,中性,well…arranged,补充式,四字,古代,常用,错落有致,《晋书 卫恒》：“纤波浓点，错落其间。”,“落”，不能读作“là”。,“致”，不能写作“至”。,,錯落有致,,,
患得患失,huàn dé huàn shī,患：忧虑。没有时怕得不到；得到后；又恐怕失去。指对个人的利害得失斤斤计较。,既无“患得患失”的念头，心情也自然安泰，决非欲“骗人安心，所以这样说”的：切祈明鉴为幸。（鲁迅《两地书》六０）,联合式；作谓语、定语、状语；含贬义。,病愈,贬义,worry about personal gains and losses,联合式,四字,古代,常用,患得患失,先秦 孔子《论语 阳货》：“其未得之也，患得之；既得之，患失之。苟患失之，无所不至矣！”,“得”，不能读作“dě”。,“患”，不能写作“幻”；“失”，不能写作“矢”。,,,ABAC式,,患得患失
一波三折,yī bō sān zhé,原指写字的笔法曲折多变。现比喻文章的结构起伏曲折。也比喻事情进行中意外的变化很多。,高阳《胡雪岩全传·萧瑟洋场》：“这笔借款由于两江总督沈葆祯的介入，一波三折，拖延甚久。”,联合式；作谓语、宾语；比喻事情进行中意外的变化很多。,皮；上游中游下游,中性,,联合式,四字,古代,常用,一波三折,《宣和书谱 太上内景神经》：“然其一波三折笔之势，亦自不苟。”,,,,一波三摺,,,
没头没脑,méi tóu méi nǎo,头、脑：比喻线索或根由。毫无线索或没有根由。,鲁迅《彷徨·肥皂》：“这是什么闷胡卢，没头没脑？”,联合式；作宾语、定语；指毫无线索或没有根由。,灭顶,中性,be dead from the neck up（to have very little common sense or ability to think clearly and reasonably）,联合式,四字,古代,常用,没头没脑,明 凌濛初《二刻拍案惊奇》第16卷：“夏主簿遭此无妄之灾，没头没脑的被贪赃州官收在监里。”,,,,没頭没腦,ABAC式,黑夜里摸黄瓜,
长此以往,cháng cǐ yǐ wǎng,长：长久；此：如此；这样。长久这样下去。,长此以往，必定搞成明朝末年那个样子，大政受言路的影响，摇摆不定，政府一件事不能办。（高阳《清宫外史》上册）,偏正式；作分句；指时间久了会有不好的结果。,,中性,continue this way,偏正式,四字,近代,常用,长此以往,鲁迅《书信集 二五六 致张廷谦》：“倘长此以往，恐怕要日见其荒凉。”,“长”，不能读作“zhǎng”。,“长”，不能写作“常”；“以”，不能写作“已”。,长此以往和“久而久之”；都有“保持相当长一段时间”的意思。不同在于：①长此以往的“此”是有所指；并多指不好的情况；“久而久之”不一定有所指；并且不论好的、坏的情况都常用。②在表示“长久”的含义上；“久而久之”重于长此以往。,長此以往,,,
岌岌可危,jí jí kě wēi,岌岌：十分危险；快要倾覆或灭亡。形容形势极其危险。,这座建筑物年久失修，已经岌岌可危了。,偏正式；作谓语、定语；形容非常危险。,水到沙塔下,中性,in imminent danger,偏正式,四字,古代,常用,岌岌可危,先秦 孟轲《孟子 万章上》：“天下殆哉，岌岌乎！”,“岌”，不能读作“jǐ”。,“岌”，不能写作“急”。,岌岌可危和“奄奄一息”、“摇摇欲坠”；都有“万般危急”的意思。但岌岌可危常用来指局势危难紧急；多用于国运、政局、战局、局势等没有生命的东西；“奄奄一息”有时指生命垂危；有时也用来指大量生命的东西；但这是比拟的用法；“摇摇欲坠”可用来形容地位、制度等就要崩溃；也可形容人或其他东西就要坠落。,,AABC式,,
遥遥无期,yáo yáo wú qī,遥遥：很远。指日期遥远得很。说不定要到何年何月。,这件事我不能遥遥无期地等下去，希望能尽快给以解决。,偏正式；作谓语、定语；含贬义。,,贬义,be for away and not within the foreseeable future,偏正式,四字,近代,常用,遥遥无期,清 李宝嘉《官场现形记》第27回：“看看前头存在黄胖姑那里银子渐渐花完，只剩得千把两银子，而放缺又遥遥无期。”,“期”，不能读作“jī”。,“期”，不能写作“其”。,,遥遥無期,AABC式,,
一败涂地,yī bài tú dì,一：一旦；涂地：“肝脑涂地”的省略。一旦失败就肝脑涂地。形容彻底失败；不可收拾。,一支思想涣散、纪律松弛的队伍参加比赛能不一败涂地吗？,紧缩式；作谓语、定语、补语；含贬义。,王；秋风吹落叶,贬义,collapse completely,紧缩式,四字,古代,常用,一败涂地,西汉 司马迁《史记 高祖本纪》：“天下方扰，诸侯并起，今置将不善，一败涂地。”,“一”，不能读作“yì”。,“涂”，不能写作“图”。,一败涂地和“一蹶不振”；都形容“失败惨重”。不同在于：①一败涂地偏重在失败的惨重程度；是就一时的情况来看；并能东山再起；“一蹶不振”偏重在失败后的严重后果；就长远的发展情况来看；是就此衰落；完蛋。②一败涂地只指失败；并可引申为“糟得一塌糊涂；坏得不可收拾”；“一蹶不振”不仅指失败；还可指挫折；指人在精神上；身体及健康上所受的打击及严重后果。,一敗涂地,,,一败涂地
量力而行,liàng lì ér xíng,量：估量；估计；行：做；干。衡量自己的力量去行事。,只有量力而行，才是实事求是的做法。,偏正式；作谓语；指做事实事求是的态度。,比着被子伸腿,中性,do what one's strength allows,偏正式,四字,古代,常用,量力而行,先秦 左丘明《左传 昭公十五年》：“力能则进，否则退，量力而行。”,“量”，不能读作“liáng”；“行”，不能读作“háng”。,“力”，不能写作“利”。,,,,,量力而行
归根到底,guī gēn dào dǐ,归结到根本上。,邓小平《提倡深入细致的工作》：“但是归根到底它是细致的工作，精雕细刻的工作，很深入的工作，结果得益处大，兵就不跑。”,作状语、分句；指归结到根本上。,,中性,in the final analysis（in the last analysis）,动宾式,四字,近代,常用,归根到底,清·张南庄《何典》第二回：“归根结柢，把一场着水人命一盘摙归去，还亏有钱使得鬼推磨。”,,,,歸根到底,,,
无孔不入,wú kǒng bù rù,孔：小洞。有空子就钻。比喻利用一切机会去活动。,帝国主义对其殖民地的经济掠夺是无孔不入的。,紧缩式；作谓语、定语、状语；含贬义。,钻空子；见缝插针；专访仲尼子孙家,贬义,lose no chance,紧缩式,四字,近代,常用,无孔不入,清 李宝嘉《官场现形记》第35回：“况且上海办捐的人，钻头觅缝，无孔不入，设或耽搁下来，被人家弄了进去，岂不是悔之不及。”,“不”，不能读作“bú”。,“入”，不能写作“人”。,,無孔不入,,钻头觅缝；莲藕炒粉条；蝎虎子上墙,
良莠不齐,liáng yǒu bù qí,莠：长得像谷子一样的野草。庄稼和野草混杂在一起分不出来。比喻好人坏人在一起不易区分。,兼之人品良莠不齐，诚恐因逸生事。（太平天国 洪秀全《整顿属员诏》）,主谓式；作谓语；用于书面语。,稗子挤在禾中间,中性,good and bad mixed together,主谓式,四字,近代,常用,良莠不齐,清 纪昀《阅微草堂笔记》：“至我辈中，好丑不一，亦如人类之内，良莠不齐。”,“莠”，不能读作“xiù”。,“莠”，不能写作“秀”。,良莠不齐和“参差不齐”都有不整齐的意思。但良莠不齐是指好人坏人都有；混在一起；“参差不齐”是指长短高低大小不一；当指人时是指水平不一。,良莠不齊,,,良莠不齐
