,拼音,解释,例子,用法,谜语,感情,英语,结构,字数,年代,热度,词语解释,出处,正音,辨形,辨析,繁体,组合,歇后语,成语故事
夜深人静,yè shēn rén jìng,深夜没有人声；非常寂静。,虽然已经是夜深人静，但爸爸仍在伏案攻读。,联合式；作定语、分句；形容十分安静。,,中性,in the quiet of night（deep in the night when all is at rest）,联合式,四字,古代,常用,夜深人静,明 冯梦龙《醒世恒言》：“深夜人静，为何叩门？”,“深”，不能读作“sēn”。,“静”，不能写作“净”。,,亱深人静,,,
在所难免,zài suǒ nán miǎn,不可能避免。,编者水平有限，错误之处，在所难免。,动宾式；作谓语、定语；用于谦词。,居家平安；家庭保鲜,中性,unavoidable（can hardly be avoided）,动宾式,四字,近代,常用,在所难免,清 李宝嘉《活地狱》第九回：“或者阳示和好，暗施奸刁的，亦在所难免。”,“难”，不能读作“nàn”。,,,在所難免,,,
忧心忡忡,yōu xīn chōng chōng,忡忡：忧愁不安的样子。心事重重；十分忧愁。,江南情形亦如此可怕吗？难道一班士大夫都不为国事忧心忡忡么？（姚雪垠《李自成》第二卷第十七章）,主谓式；作定语、状语、补语；含贬义。,尤中四心,贬义,have a heart loaded with worry,主谓式,四字,古代,常用,忧心忡忡,《诗经 召南 草虫》：“未见君子，忧心忡忡。”,“忡”，不能读作“zhōng”。,“忡”，不能写作“仲”。,忧心忡忡和“忧心如焚”、“惴惴不安”；都含有“十分忧愁不安”的意思。但忧心忡忡偏重于“忧愁、因心事重重而不安”；“忧心如焚”偏重于“焦急”；表示忧虑、焦急到了极点；“惴惴不安”偏重于因担惊受怕而不安。,憂心忡忡,ABCC式,,忧心忡忡
奄奄一息,yǎn yǎn yī xī,奄奄：气息微弱的样子；息：呼吸时进出的气。只剩下微弱的一口气。引申为事物即将消亡或毁灭。,他已被打得体无完肤，奄奄一息了。,偏正式；作谓语、定语、补语；含贬义。,油干灯草尽,贬义,critically ill with a little breath,偏正式,四字,古代,常用,奄奄一息,明 冯梦龙《东周列国志》第87回：“惠王亲往问疾，见痤病势已重，奄奄一息。”,“奄”，不能读作“yān”；“一”，不能读作“yì”。,“奄”，不能写作“淹”、“掩”。,见“气息奄奄”、“岌岌可危”。,,AABC式,耗干了油的灯火；盐碱地的庄稼,
有朝一日,yǒu zhāo yī rì,朝：日；天。指将来有一天。,我想有朝一日他们会成为夫妻的。,复杂式；作状语；指将来的某一天。,元旦,中性,some day in the future,复杂式,四字,古代,常用,有朝一日,元 关汉卿《救风尘》第一折：“我也劝你不得；有朝一日准备着搭救你块望夫石。”,“朝”，不能读作“cháo”。,,,,,,
万事如意,wàn shì rú yì,如意：符合心意。一切都符合心意，很顺利。,路遥《平凡的世界》第六卷第38章：“我只说：愿年轻人万事如意！”,作谓语；用于祝辞。,最顺利的时候,中性,carry all before one（sweep all before one）,主谓式,四字,近代,常用,万事如意,清·吴趼人《二十年目睹之怪现状》第15回：“不过都是在那里邀福，以为我做了好事，便可以望上天默佑，万事如意的。”,,,,萬事如意,,,
一成不变,yī chéng bù biàn,成：制定；形成。一经形成；永不改变。指守旧不变或固守陈法。,事物都是在发展的，世界上没有一成不变的东西。,联合式；作谓语；含贬义。,十改其九,贬义,fixed and unchangeable,联合式,四字,古代,常用,一成不变,西汉 戴圣《礼记 王制》：“刑者，侀也。侀者，成也，一成而不可变，故君子尽心焉。”,“一”，不能读作“yì”。,“成”，不能写作“诚”。,一成不变和“原封不动”；都含有“一点没有改变”的意思。区别在于：①一成不变着眼于事物本身没有变化。多表示人不能用发展、运动的观点观察事物；“原封不动”着眼于外界力量未对事物加以变动。多表示外界力量对有关事物采取保留、不加变动的行动。②一成不变多用于否定句；极少用于肯定句；“原封不动”在肯定句和否定句中都常出现。“原封不动”可以形容照抄照搬；不根据实际情况加以变动；取舍；一成不变不能。,一成不變,,,
春暖花开,chūn nuǎn huā kāi,春天气候温暖；百花盛开。形容美丽的景色。比喻事物得以顺利发展的良好环境或机遇。,一年之计在于春，在这春暖花开的季节，正是努力学习的大好时机，,复句式；作主语、分句；比喻良好的时机，美好的时光。,,中性,during the warmth of spring all the flowers bloom,联合式,四字,古代,常用,春暖花开,明 朱国祯《涌幢小品 南内》：“春暖花开，命中贵陪内阁儒臣宴赏。”,“暖”，不能读作“nǎn”。,“暖”，不能写作“缓”。,,萅煖蘤開,,,
接二连三,jiē èr lián sān,一个接着一个；连续不断。,于是接二连三，牵五挂四，将一条街烧得如“火焰山”一般。（清 曹雪芹《红楼梦》第一回）,联合式；作定语、状语；形容连续不断。,一；从一算起,中性,follow close on another,联合式,四字,近代,常用,接二连三,清 曹雪芹《红楼梦》第99回：“家中事情接二连三，也无暇及此。”,“接”，不能读作“jié”。,“连”，不能写作“联”。,接二连三和“接踵而至”；都形容“一个接着一个；连续不断”。但接二连三多用于口语；“接踵而至”多用于书面语。,接二連三,,,接二连三
发扬光大,fā yáng guāng dà,光大：使显赫盛大。使好的优秀的事物现象不断发展；从而更加完善、提高。,最合理的孝道恐怕是继承父辈的成就，把它发扬光大，好教下一辈得到更好的精神的与物质的遗产。（老舍《四世同堂》六十四）,联合式；作谓语、宾语；多用于讲话。,,中性,carry forward（bring to great height of development; further develop and promote）,联合式,四字,古代,常用,发扬光大,宋 黄榦《黄勉斋文集 刘正之遂初堂记》：“备前人之美发挥而光大之。”,“发”，不能读作“fà”。,“光”，不能写作“广”；“扬”，不能写作“杨”。,,發揚光大,,,
七嘴八舌,qī zuǐ bā shé,形容人多嘴杂；议论纷纷。也比喻让别人充分发表意见。,老师的话刚说完，同学们就七嘴八舌地议论起来。,联合式；作谓语、状语；形容人。,一家15口,中性,all talking in confusion,联合式,四字,古代,常用,七嘴八舌,《好逑传》第五回：“众人正跑得有兴头上，忽被铁公子拦住，便七嘴八舌地乱嚷。”,“嘴”，不能读作“zhuǐ”。,“嘴”，不能写作“咀”。,七嘴八舌和“众说纷纭”；都有“议论纷纷”的意思。但七嘴八舌多用于口语；偏重指人多嘴杂；你说一句；我说一句；“众说纷纭”偏重指意见多种多样。,,,一家十五口,
络绎不绝,luò yì bù jué,络绎：前后相连；连续不断。不绝：也是不断之意。形容行人、车马、船只等来往频繁；连续不断。也作“络绎不断”。,我梦里所到的地方，竟是一片康庄大道，马来车往，络绎不绝。（清 李宝嘉《官场现形记》第六十回）,联合式；作谓语、定语、状语；含褒义。,,褒义,in an endless stream,联合式,四字,古代,常用,络绎不绝,南朝 宋 范晔《后汉书 南匈奴传》：“窜逃去塞者，络绎不绝。”,“绎”，不能读作“zé”。,“络”，不能写作“洛”。,络绎不绝和“源源不断”；都形容接连不断。但络绎不绝多用于人、马、车。,络繹不絶,,,
无所适从,wú suǒ shì cóng,适：往；从：听从；跟从。不知听从哪一个好。指不知怎么办才好。,某书应读某音，敝处未得高明指教，往往读错，以致后学无所适从。（清 李汝珍《镜花缘》第十六回）,动宾式；作谓语、宾语、定语；形容不知怎幺办才好。,未嫁,中性,be at sea,动宾式,四字,古代,常用,无所适从,宋 姚宽《西溪丛语》：“观古今诸家潮之说者多矣……源殊派异，无所适从。”,“从”，不能读作“cōng”。,“适”，不能写作“事”。,无所适从和“莫衷一是”都含有不知怎样才好的意思。但无所适从偏重于不知听从谁的才好；“莫衷一是”偏重于意见分歧；无法断定哪一个好。,無所適従,,一国三公,无所适从
心旷神怡,xīn kuàng shén yí,心境开阔；精神愉快。旷：空阔；怡：愉快。,又登海天阁，见万顷银涛，千山削翠，心旷神怡。（清 陈忱《水浒后传》第四十回）,联合式；作谓语、状语；含褒义。,,褒义,refreshed in spirit,联合式,四字,古代,常用,心旷神怡,宋 范仲淹《岳阳楼记》：“登斯楼也，则有心旷神怡，宠辱皆忘，把酒临风，其喜洋洋者矣。”,“怡”，不能读作“tái”。,“旷”，不能写作“矿”。,,心曠神怡,,,心旷神怡
有条不紊,yǒu tiáo bù wěn,紊：乱。有条理；不紊乱。,听上去倒也是原原本本，有条不紊。 ◎清 李宝嘉《官场现形记》第五十六回,联合式；作谓语、定语、状语；含褒义。,,褒义,everything in good order and well arranged,联合式,四字,古代,常用,有条不紊,【出处】《尚书 盘庚上》：“若网在纲，有条而不紊。”,“紊”，不能读作“jì”。,“紊”，不能写作“絮”。,有条不紊和“有条有理”；都可形容工作、说话、做事、作文方面；也可用在思维活动等方面。,有條不紊,,,有条不紊
如愿以偿,rú yuàn yǐ cháng,按所希望的那样得到满足。指愿望实现。,他终于如愿以偿，考上的北京大学。,偏正式；作谓语、宾语、状语、补语；含褒义。,窃得虎符报信陵,褒义,achieve what one wishes,偏正式,四字,近代,常用,如愿以偿,清 李宝嘉《官场现形记》第46回：“在抚台面前说了许多好话，后来也祥甫竟如愿以偿，补授临清州缺。”,“偿”，不能读作“shǎng”。,“偿”，不能写作“尝”。,如愿以偿和“称心如意”都可表示“愿望实现；极其满意”之意。但如愿以偿偏重于“称”和“如”；强调对人或事物感到满意；是一种满足的心理。,如願以償,,,如愿以偿
不可一世,bù kě yī shì,可：许可；赞成。没有赞许过当时的任何人。形容人自命不凡；狂妄自大到了极点。,盖兴会飙举，不可一世矣。（柳亚子《燕子龛遗诗序》）,动宾式；作谓语、定语、补语；含贬义，形容狂妄自大。,曰；朝令夕改；废除终身制,贬义,consider oneself unexcelled in the world,动宾式,四字,古代,常用,不可一世,宋 罗大经《鹤林玉露》第15卷：“王荆公少年，不可一世士，独怀刺候濂溪，三及门而三辞焉。”,“一”，不能读作“yí”。,“世”，不能写作“士”。,不可一世和“目空一切”；都形容狂妄自大；瞧不起别人。但不可一世语义重。,不可一丗,,,
无可厚非,wú kě hòu fēi,厚：重；非：否定。没有什么可过分指责或批评的；指事情有一定的道理或原因。,作者的动机无可厚非，但客观效果则不尽符合作者的动机。茅盾《一九六０年短篇小说漫评》,动宾式；作谓语；用于人或事情等。,,中性,give no cause for much criticism,动宾式,四字,古代,常用,无可厚非,《汉书 王莽传中》：“莽怒，免英官。后颇觉悟，曰：‘英亦未可厚非。’”,,“非”，不能写作“飞”。,见“无可非议”。,無可厚非,,,无可厚非
无关紧要,wú guān jǐn yào,紧要：急切的，重要的。不重要，不会影响大局。,霍达《穆斯林的葬礼》第八章：“现在，说它是石头、是泥土都无关紧要了。”,作谓语、定语；指不会影响大局。,,中性,neither here nor there（not to matter a farthing）,动宾式,四字,近代,常用,无关紧要,清·李汝珍《镜花缘》第十七回：“可见字音一道，乃读书人不可忽略的。大贤学问渊博，故视为无关紧要；我们后学，却是不可少的。”,,,,無關緊要,,,
跌跌撞撞,diē diē zhuàng zhuàng,形容走路不稳的样子。,路遥《平凡的世界》第五卷第26章：“他离开小桌，跌跌撞撞走过去，一头倒在床上，继续哭着。”,作状语；指不顺畅。,,中性,stagger along（dodder along）,联合式,四字,近代,常用,跌跌撞撞,清·韩邦庆《海上花列传》第42回：“脚底下不晓得高低，跌跌撞撞，进了右首房间。”,,,,,AABB式,,
支离破碎,zhī lí pò suì,支离：分散。形容散乱不整；残缺不全。,我们不要把文章分析得支离破碎。,联合式；作谓语、定语、补语；含贬义。,十石,贬义,be reduced to fragments,联合式,四字,古代,常用,支离破碎,元 许谦《白云集》：“近代以文辞取士，而不考其实，惟务雕镌镂刻，破碎支离，波淫邪遁之辞，靡所不至。”,“破”，不能读作“pè”。,“碎”，不能写作“粹”。,支离破碎和“四分五裂”；都有“破碎不完整”的意思。但支离破碎偏重于表示“散乱、没条理”；“四分五裂”偏重于表示“不团结”。,支離破碎,,,
义无反顾,yì wú fǎn gù,义：宜；应该做的事；反顾：回头看。做正当合理的事；只有上前的事；绝不回头。,朱成功身受大明的厚恩，只有一死图报，义无反顾。（华而实《汉衣冠》二）,主谓式；作谓语、定语、状语；含褒义。,向前看；不堪回首；一切向前看,褒义,proceed without desitation,主谓式,四字,古代,常用,义无反顾,西汉 司马迁《史记 司马相如列传》：“触白刃，冒流矢，义不反顾，计不旋踵，人怀怒心。”,“义”，不能读作“yī”。,“反”，不能写作“返”。,义无反顾与“破釜沉舟”有别：义无反顾多形容人的精神、行为；不能与能愿动词配合运用。“破釜沉舟”多指意志；语意较重；可与“能够”、“应该”、“必须”等能愿动词配合运用。,義無反顧,,,义无反顾
相依为命,xiāng yī wéi mìng,依：依靠；为命：为生；过日子。互相依靠着过日子。泛指互相依靠；谁也离不开谁。,死而复生的只有这些杂乱的败草。永逝不返的却是我们相依为命的慈母。（郭沫若《棠棣之花》）,偏正式；作谓语、定语；用于人或事物。,口令；一人叩,中性,rely upon each other for life,偏正式,四字,古代,常用,相依为命,晋 李密《陈情事表》：“母孙二人，更相为命。”,“相”，不能读作“xiàng”；“为”，不能读作“wèi”。,“依”，不能写作“一”。,,相依為命,,瞎老头跟瘸老伴,相依为命
面目全非,miàn mù quán fēi,面目：样子；非：不是。样子跟从前完全不同。形容变化大得很。,它的厄运，是在好书被有权者用相似的本子来掉换，年深月久，弄得面目全非。（鲁迅《而已集 谈所谓“大内档案”》）,主谓式；作谓语、定语、状语；含贬义。,尽是谜底,贬义,lose one's identity,主谓式,四字,近代,常用,面目全非,清 蒲松龄《聊斋志异 陆判》：“濯之，盆水尽赤。举首则面目全非，又骇极。”,,,见“改头换面”。,靣目全非,,,
千变万化,qiān biàn wàn huà,形容变化非常多；没有穷尽。,官场中的事，千变万化，那里说得定呢。（清 吴趼人《二十年目睹之怪现状》第七回）,联合式；作谓语、定语；用于景物。,1000x10,中性,unending changes,联合式,四字,古代,常用,千变万化,先秦 庄周《庄子 田子方》：“独有一丈夫，儒服而立乎公门。公即召而问以国事，千变万化而不穷。”,“变”，不能读作“piàn”。,“化”，不能写作“话”。,千变万化和“变化多端”都可形容“变化很多；很大”。但千变万化偏重于变化的次数极多；而“变化多端”偏重变化多而没有头绪的规律。,千變萬化,,,千变万化
非同小可,fēi tóng xiǎo kě,小可：寻常；一般。不同于一般的小事。形容事情重要或情况严重；不可忽视。也指人的学问、本领不同寻常。,进了郑家门，这一惊非同小可，只见郑老爹两眼哭得通红。（清 吴敬梓《儒林外史》第二十回）,动宾式；作谓语、定语；指事关重大。,奇；不像鄙人；和鄙人不一样,中性,be not usual,动宾式,四字,古代,常用,非同小可,元 关汉卿《魔合罗》第三折：“人命事关天关地，非同小可！”,,“可”，不能写作“事”。,非同小可和“非同寻常”；都有“事情不平常；不可轻视”的意思。不同在于：①非同小可偏重于“重大、严重”；而“非同寻常”偏重于“突出”。②非同小可常形容“惊”、“喜”等感情达到强烈程度及影响；“非同寻常”不能。,,,长江里饮水；古玩店失火,非同小可
欣喜若狂,xīn xǐ ruò kuáng,形容高兴到了极点。欣喜：欢喜；若：好像；狂：感情失去控制。,全班同学欣喜若狂，向取得第一名的同学庆祝。,主谓式；作谓语、定语、状语；形容人的狂喜心情。,,中性,go into raptures,主谓式,四字,古代,常用,欣喜若狂,唐 杜甫《闻官军收河南河北》：“却看妻子愁何在，漫卷诗书喜欲狂。”,,“欣”，不能写作“心”。,欣喜若狂和“喜出望外”；都表示非常高兴。但欣喜若狂形容高兴得像发疯一样；“喜出望外”强调意外的高兴。,俽喜若狂,,,
浩浩荡荡,hào hào dàng dàng,指水势汹涌广阔浩大。后形容规模宏大；气势雄壮。,一时只见宁府大殡浩浩荡荡，压地银山一般从北而至。（清 曹雪芹《红楼梦》第十四回）,联合式；作谓语、定语、状语；形容人流或水流等。,,中性,go forward with great strength and vigour,联合式,四字,古代,常用,浩浩荡荡,宋 范仲淹《岳阳楼记》：“浩浩荡荡，横无边涯。”,“荡”，不能读作“tāng”。,“浩”，不能写作“号”；“荡”，不能写作“堂”。,,浩浩蕩蕩,AABB式,太平洋里洗脚,
首当其冲,shǒu dāng qí chōng,冲：交通要道。比喻最先受到攻击或遭到灾难。,毛泽东《抗日游击战争的战略问题》第六章第一节：“是没有疑义的，平原的游击根据地自将首当其冲。”,动宾式；作谓语、定语；指首先受到攻击。,淋浴；头攻,中性,be the first to be affected,动宾式,四字,古代,常用,首当其冲,晋 陈寿《三国志 公孙瓒传》裴松之注引《献帝春秋》：“盖闻在昔衰周之世，僵尸流血，以为不然，岂意今日身当其冲。”,“当”，不能读作“dàng”；“冲”，不能读作“chòng”。,“首”，不能写作“手”。,,首當其衝,,水龙头下洗脑袋,
不堪设想,bù kān shè xiǎng,不堪：不能；设想：对未来情况的想象、推测。事情的结果不能想象；指会向很坏、很危险的方向发展。,要不是他及时发现了问题所在，后果真是不堪设想。,动宾式；作谓语、定语、补语；用于指消极方面的事。,,贬义,be deadful to contemplate（be most disastrous; a inconceivable）,动宾式,四字,近代,常用,不堪设想,清 林则徐《林文忠公政书》：“内地膏脂，年年如些剥丧，岂堪设想！”,“堪”，不能读作“shèn”。,“想”，不能写作“相”。,不堪设想和“不可思议”；都有“不能想象”的意思。但在适用对象上有区别。不堪设想适用对象是严重的、不良的后果；“不可思议”的适用对象是奇妙的事物或深奥的不可理解的事情或道理。,不堪設想,,,
突飞猛进,tū fēi měng jìn,疾速飞跃；迅疾前进。形容进步和发展特别迅速。,社会主义制度促进了我国生产力的突飞猛进的发展。（毛泽东《关于正确处理人民内部矛盾的问题》）,联合式；作谓语、宾语、定语；含褒义。,和尚驾驶战斗机,褒义,advance rapidly（advance by leaps and bounds; make giant strides; advance with sevenleague strides）,联合式,四字,当代,常用,突飞猛进,邹韬奋《患难馀生记》第三章：“进步文化的突飞猛进，虽有利于国家民族，虽有利于人民大众，但却是顽固派反动派的莫大的障碍物。”,,“进”，不能写作“劲”。,突飞猛进和“日新月异”都可形容变化、进步快；但突飞猛进强调速度快；而“日新月异”强调面貌。,突飛猛進,,,
光明正大,guāng míng zhèng dà,心地光明；言行正派。正大：公正无私。,大仙是光明正大之人，就以他的诳语作真。（明 吴承恩《西游记》第五回）,联合式；作谓语、定语、状语；含褒义。,中秋月；十五的月亮,褒义,just and honorable,联合式,四字,古代,常用,光明正大,宋 朱熹《朱子语类 易九》第73卷：“圣人所说底话，光明正大。”,“大”，不能读作“dá”。,,“光明磊落”和“光明正大”都含有“心地光明”的意思；都能用于人及其言行；有时可通用。但“光明磊落”偏重在人的精神品质；指胸怀坦白；“光明正大”偏重指人的行为正当、正派。,,,,
口口声声,kǒu kǒu shēng shēng,不止一次；反反复复地陈述或表白。形容总把某种说法挂在口头上。,他口口声声地说想家却一直没有回去。,联合式；作状语；形容反反复复地陈述。,双方会谈,中性,say again and again（keep on saying glibly announce）,联合式,四字,古代,常用,口口声声,元 石君宝《秋胡戏妻》第三折：“你也曾听杜宇，他那里口口声声撺掇，先生不如归去。”,,,,口口聲聲,AABB式,,
石破天惊,shí pò tiān jīng,山崩石裂；有惊天动地之势。原形容箜篌的乐声忽然高亢；震动了整个天界。现多指突发的大事或文章、议论的惊人。,陈继泰被他们这样的一来，好似那雷霆乍震，石破天惊，只吓得个肺腑皆崩，神魂出窍。（清 张春帆《宦海》第十九回）,联合式；作谓语、定语、补语；形容震惊。,,中性,abmirably wonderful,联合式,四字,古代,常用,石破天惊,唐 李贺《歌诗集 李凭箜篌引》：“女娲炼石补天处，石破天惊逗秋雨。”,“石”，不能读作“dàn”。,“惊”，不能写作“京”。,石破天惊和“惊天动地”都可以形容“让人惊动；使人惊奇”之意；但石破天惊有“不同凡响；不一般”的意思；而“惊天动地”没有。“惊天动地”；可形容变化巨大；而石破天惊不能用于此意。,石破天驚,,,
千辛万苦,qiān xīn wàn kǔ,许许多多；各种各样的辛劳艰苦。,侨胞的金钱不是容易得到的，是由于他们胼手胝足，千辛万苦，省吃俭用，积累起来的。（邹韬奋《抗战以来 热烈爱国的千万侨胞》）,联合式；作谓语、宾语；含褒义。,唐僧去西天取经,褒义,innumerable hardships,联合式,四字,古代,常用,千辛万苦,元 无名氏《飞刀对箭》：“我受了些热血相喷，万苦千辛，恰便似翻滚滚的雪浪里逃生。”,“苦”，不能读作“ruò”。,“辛”，不能写作“心”。,千辛万苦与“含辛茹苦”有别：千辛万苦着重于辛苦的“多、大”；常用作宾语；“含辛茹苦”着重于对辛苦的“忍受”；常用作状语。,千辛萬苦,,,千辛万苦
物美价廉,jià lián wù měi,廉：便宜。东西价钱便宜，质量又好。,提倡物美价廉，老少无欺，反对粗制滥造，偷工减料。（朱德《要把手工业生产合作社搞好》）,作谓语、宾语、定语；用于商业。,,中性,a small price for a good article（cheap and fine）,联合式,四字,近代,常用,物美价廉,清 吴趼人《近十年之怪现状》第十回：“苏州有个朋友写信来，要印一部书。久仰贵局的价廉物美，所以特来求教。”,,,,物美價亷,,,
